{
  "kind": "domain_policy_rule",
  "version": "v1",
  "rule_id": "gdpr-eu.lawful-basis-required",
  "status": "active",
  "scope": "global",
  "conditions": [
    {
      "asset": "data"
    }
  ],
  "effect": "deny",
  "priority": 1000,
  "exceptions": [],
  "evidence_requirements": [
    {
      "evidence_type": "decision_record"
    }
  ]
}
