{
  "kind": "domain_policy_rule",
  "version": "v1",
  "rule_id": "gdpr-eu.subject-rights-impact",
  "status": "active",
  "scope": "global",
  "conditions": [
    {
      "asset": "data"
    }
  ],
  "effect": "review_required",
  "priority": 780,
  "exceptions": [],
  "evidence_requirements": [
    {
      "evidence_type": "decision_record"
    }
  ]
}
